file,lane_annotation20160405_antipuro_hek293t_bcanormalized_rep1_richleuargtorin1pluspuro_ladder_minuspuro,"Rich_3hours_PlusPuro_1, Leu_3hours_PlusPuro_1, Arg_3hours_PlusPuro_1, Torin1_3hours_PlusPuro_1, KaleidoscopeLadder, Rich_3hours_MinusPuro_1, Leu_3hours_MinusPuro_1, Arg_3hours_MinusPuro_1, Torin1_3hours_MinusPuro_1"20160405_antipuro_hek293t_bcanormalized_rep2_richleuargtorin1pluspuro_ladder_minuspuro,"Rich_3hours_PlusPuro_2, Leu_3hours_PlusPuro_2, Arg_3hours_PlusPuro_2, Torin1_3hours_PlusPuro_2, KaleidoscopeLadder, Rich_3hours_MinusPuro_2, Leu_3hours_MinusPuro_2, Arg_3hours_MinusPuro_2, Torin1_3hours_MinusPuro_2"20160405_antipuro_hek293t_bcanormalized_rep3_richleuargtorin1pluspuro_ladder_minuspuro,"Rich_3hours_PlusPuro_3, Leu_3hours_PlusPuro_3, Arg_3hours_PlusPuro_3, Torin1_3hours_PlusPuro_3, KaleidoscopeLadder, Rich_3hours_MinusPuro_3, Leu_3hours_MinusPuro_3, Arg_3hours_MinusPuro_3, Torin1_3hours_MinusPuro_3",(same for other antibodies),